{
  "id": "ar-tamil-jathagam",
  "name": "AR Tamil Jathagam",
  "description": "A Tamil and English astrology app for horoscopes, Panchanga, and compatibility.",
  "category": "culture",
  "featured": false,
  "visible": true,
  "needsReview": true,
  "repositories": [
    {
      "ref": "actionanand/ar-tamil-jathagam",
      "role": "primary"
    }
  ],
  "links": [],
  "notes": [
    "GitHub repository metadata not accessible; confirm visibility and correct URL.",
    "Android listed in policy-hub, but NOT marked as released to Google Play; do not generate a Play Store URL."
  ],
  "schemaVersion": 1,
  "policyHub": {
    "appId": "ar-tamil-jathagam"
  },
  "overrides": {},
  "projectType": "application",
  "order": 13,
  "technologies": []
}
