{
  "id": "wifi-chat",
  "name": "WiFi Chat",
  "description": "Real-time chat app for devices on the same WiFi network",
  "category": "connectivity",
  "featured": false,
  "visible": true,
  "needsReview": false,
  "repositories": [
    {
      "ref": "actionanand/wifi-chat",
      "role": "primary"
    }
  ],
  "links": [],
  "notes": [],
  "schemaVersion": 1,
  "overrides": {},
  "projectType": "playground",
  "classificationReview": true,
  "order": 22,
  "technologies": []
}
