{
  "id": "artamizhsolai",
  "name": "AR Tamizh Solai",
  "description": "A Tamil literature publication exploring classics, poetry, language, and culture.",
  "category": "content",
  "featured": false,
  "visible": true,
  "needsReview": true,
  "repositories": [
    {
      "ref": "actionanand/artamizhsolai",
      "role": "primary"
    }
  ],
  "links": [],
  "notes": [],
  "schemaVersion": 1,
  "overrides": {},
  "projectType": "application",
  "order": 42,
  "technologies": []
}
