{
  "schemaVersion": 1,
  "id": "angular-deferrable",
  "name": "Angular Deferrable",
  "description": "angular - deferrable with example",
  "category": "developer-tools",
  "projectType": "playground",
  "visible": true,
  "featured": false,
  "needsReview": false,
  "classificationReview": false,
  "order": 52,
  "repositories": [
    {
      "ref": "actionanand/angular-deferrable",
      "role": "primary"
    }
  ],
  "links": [],
  "notes": [
    "Imported from public GitHub metadata and README. Hosted URLs are references, not uptime guarantees."
  ],
  "overrides": {},
  "technologies": ["angular"]
}
