{
  "id": "folder-flow",
  "name": "Folder Flow",
  "description": "WiFi & FTP file sharing app — share files between devices on your local network",
  "category": "connectivity",
  "featured": false,
  "visible": true,
  "needsReview": false,
  "repositories": [
    {
      "ref": "actionanand/folder-flow",
      "role": "primary"
    }
  ],
  "links": [],
  "notes": [],
  "schemaVersion": 1,
  "overrides": {},
  "projectType": "playground",
  "classificationReview": true,
  "order": 23,
  "technologies": []
}
