{
  "id": "glyph-forge",
  "name": "Glyph Forge",
  "description": "Load, inspect, and style TTF, OTF, WOFF, and WOFF2 fonts.",
  "category": "developer-tools",
  "featured": false,
  "visible": true,
  "needsReview": false,
  "repositories": [
    {
      "ref": "actionanand/glyph-forge",
      "role": "primary"
    }
  ],
  "links": [],
  "notes": [],
  "schemaVersion": 1,
  "overrides": {},
  "projectType": "tool",
  "order": 25,
  "technologies": []
}
