{
  "id": "svg-forge",
  "name": "SVG Forge",
  "description": "All-in-one SVG workspace for editing, optimizing, previewing, and exporting vector graphics.",
  "category": "developer-tools",
  "featured": false,
  "visible": true,
  "needsReview": false,
  "repositories": [
    {
      "ref": "actionanand/svg-forge",
      "role": "primary"
    }
  ],
  "links": [],
  "notes": [],
  "schemaVersion": 1,
  "overrides": {},
  "projectType": "tool",
  "order": 20,
  "technologies": []
}
