{
  "id": "qurio",
  "name": "Qurio",
  "description": "Multilingual learning, quizzes, progress tracking, and exam preparation.",
  "category": "education",
  "featured": true,
  "visible": true,
  "needsReview": false,
  "repositories": [
    {
      "ref": "actionanand/qurio",
      "role": "primary"
    }
  ],
  "links": [],
  "notes": [],
  "schemaVersion": 1,
  "policyHub": {
    "appId": "qurio"
  },
  "overrides": {},
  "projectType": "application",
  "order": 8,
  "technologies": []
}
