{
  "id": "arflix",
  "name": "ARFlix",
  "description": "A movie and TV discovery app with TMDb details and a curated collection.",
  "category": "entertainment",
  "featured": false,
  "visible": true,
  "needsReview": true,
  "repositories": [
    {
      "ref": "actionanand/arflix",
      "role": "primary"
    }
  ],
  "links": [],
  "notes": [],
  "schemaVersion": 1,
  "policyHub": {
    "appId": "arflix"
  },
  "overrides": {},
  "projectType": "application",
  "order": 39,
  "technologies": []
}
