{
  "schemaVersion": 1,
  "id": "angular-lib-demo",
  "name": "Angular Library Workspace",
  "description": "It's an angular workspace where simple angular app and angular library are used.",
  "category": "developer-tools",
  "projectType": "library",
  "visible": true,
  "featured": false,
  "needsReview": false,
  "classificationReview": false,
  "order": 47,
  "repositories": [
    {
      "ref": "actionanand/angular-lib-demo",
      "role": "primary"
    }
  ],
  "links": [
    {
      "kind": "npm",
      "label": "@ng-ar/md-input",
      "url": "https://www.npmjs.com/package/@ng-ar/md-input",
      "source": "https://github.com/actionanand/angular-lib-demo/blob/main/README.md",
      "verified": "readme-reference",
      "id": "npm-1"
    },
    {
      "kind": "npm",
      "label": "@ng-ar/svg-icon",
      "url": "https://www.npmjs.com/package/@ng-ar/svg-icon",
      "source": "https://github.com/actionanand/angular-lib-demo/blob/main/README.md",
      "verified": "readme-reference",
      "id": "npm-2"
    },
    {
      "kind": "npm",
      "label": "@ng-ar/input",
      "url": "https://www.npmjs.com/package/@ng-ar/input",
      "source": "https://github.com/actionanand/angular-lib-demo/blob/main/README.md",
      "verified": "readme-reference",
      "id": "npm-3"
    },
    {
      "kind": "npm",
      "label": "@ng-ar/bg-svg",
      "url": "https://www.npmjs.com/package/@ng-ar/bg-svg",
      "source": "https://github.com/actionanand/angular-lib-demo/blob/main/README.md",
      "verified": "readme-reference",
      "id": "npm-4"
    }
  ],
  "notes": [
    "Imported from public GitHub metadata and README. Hosted URLs are references, not uptime guarantees."
  ],
  "overrides": {},
  "technologies": ["angular"]
}
